{
  "sections": [
    {
      "key": "overview",
      "title": "The book in brief",
      "blocks": [
        {
          "type": "callout",
          "tone": "important",
          "spans": [
            {
              "text": "Knowledge work is slow because it waits, and the waiting is governed by how much work is in progress and how busy people are.",
              "cites": [
                "ch01/s01/p002",
                "ch02/s01/p001",
                "ch03/s01/p004"
              ]
            }
          ]
        },
        {
          "type": "paragraph",
          "spans": [
            {
              "text": "The book starts from a measurement: most of an item's delivery time is spent waiting, not being worked on. ",
              "cites": [
                "ch01/s01/p002"
              ]
            },
            {
              "text": "Faster people or longer hours cannot fix a delay that happens while nobody is working.",
              "cites": [
                "ch01/s02/p003"
              ]
            }
          ]
        },
        {
          "type": "paragraph",
          "spans": [
            {
              "text": "Two pieces of queueing arithmetic explain the waiting. ",
              "cites": [
                "ch02/s01/p001"
              ]
            },
            {
              "text": "Little's law ties work in progress to time in the system, so more WIP at the same throughput means longer waits; ",
              "cites": [
                "ch02/s01/p001",
                "ch02/s01/p005"
              ]
            },
            {
              "text": "the utilization curve shows waiting staying modest to about 70% and exploding past 80%, made worse by variability.",
              "cites": [
                "ch03/s01/p004",
                "ch03/s02/p003"
              ]
            }
          ]
        },
        {
          "type": "paragraph",
          "spans": [
            {
              "text": "The middle of the book turns the mechanism into levers and tests them: WIP limits cut average cycle time from 31 to about 10 days with flat throughput, ",
              "cites": [
                "ch04/s02/t001",
                "ch04/s02/p005"
              ]
            },
            {
              "text": "and smaller batches shorten waits for the same reason.",
              "cites": [
                "ch05/s02/p003"
              ]
            }
          ]
        },
        {
          "type": "paragraph",
          "spans": [
            {
              "text": "It closes by finding the queues nobody measures — approvals, hand-offs, work turned away at a limit — ",
              "cites": [
                "ch06/s01/p001",
                "ch06/s02/p004"
              ]
            },
            {
              "text": "and by recasting management as tending the flow of work rather than the busyness of people.",
              "cites": [
                "ch07/s01/p001"
              ]
            }
          ]
        },
        {
          "type": "bullets",
          "items": [
            [
              {
                "text": "Forecast delivery from WIP and throughput instead of effort estimates.",
                "cites": [
                  "ch02/s02/p002"
                ]
              }
            ],
            [
              {
                "text": "Choose a WIP limit and a slack level for a team, and defend them.",
                "cites": [
                  "ch04/s01/p002",
                  "ch03/s03/p006"
                ]
              }
            ],
            [
              {
                "text": "Find and shorten the hidden queues in your own process.",
                "cites": [
                  "ch06/s02/p004"
                ]
              }
            ]
          ]
        }
      ]
    },
    {
      "key": "map",
      "title": "The big picture",
      "blocks": [
        {
          "type": "diagram",
          "direction": "LR",
          "nodes": [
            {
              "id": "wip",
              "label": "Work in progress"
            },
            {
              "id": "util",
              "label": "Utilization"
            },
            {
              "id": "var",
              "label": "Variability"
            },
            {
              "id": "wait",
              "label": "Waiting time"
            },
            {
              "id": "cycle",
              "label": "Cycle time"
            },
            {
              "id": "limit",
              "label": "WIP limit"
            },
            {
              "id": "batch",
              "label": "Small batches"
            },
            {
              "id": "slack",
              "label": "15–20% slack"
            },
            {
              "id": "hidden",
              "label": "Hidden queues"
            }
          ],
          "edges": [
            {
              "from": "wip",
              "to": "wait",
              "label": "Little's law"
            },
            {
              "from": "util",
              "to": "wait",
              "label": "explodes past ~80%"
            },
            {
              "from": "var",
              "to": "wait",
              "label": "multiplies"
            },
            {
              "from": "wait",
              "to": "cycle",
              "label": "dominates"
            },
            {
              "from": "limit",
              "to": "wip",
              "label": "caps"
            },
            {
              "from": "batch",
              "to": "wip",
              "label": "reduces"
            },
            {
              "from": "slack",
              "to": "util",
              "label": "caps"
            },
            {
              "from": "hidden",
              "to": "wait",
              "label": "adds unmeasured"
            }
          ],
          "cites": [
            "ch02/s01/p001",
            "ch03/s01/p004",
            "ch03/s02/p003",
            "ch01/s01/p002",
            "ch04/s01/p002",
            "ch05/s02/p003",
            "ch03/s03/p006",
            "ch06/s01/p001"
          ]
        },
        {
          "type": "paragraph",
          "spans": [
            {
              "text": "Read the map from the right: cycle time is mostly waiting, and every lever the book offers acts on waiting through work in progress or utilization.",
              "cites": [
                "ch01/s01/p002",
                "ch07/s01/p001"
              ]
            }
          ]
        }
      ]
    },
    {
      "key": "deep_dive",
      "title": "The core ideas in depth",
      "blocks": [
        {
          "type": "heading",
          "level": 2,
          "text": "Little's law"
        },
        {
          "type": "definition",
          "term": "Little's law",
          "spans": [
            {
              "text": "Average work in progress equals throughput times average time in the system.",
              "cites": [
                "ch02/s01/p001"
              ]
            }
          ]
        },
        {
          "type": "paragraph",
          "spans": [
            {
              "text": "Because throughput is set by capacity, adding work in progress without adding capacity only lengthens the time each item spends inside; ",
              "cites": [
                "ch02/s01/p003",
                "ch02/s01/p005"
              ]
            },
            {
              "text": "the same identity turns into a forecast: divide the items in progress by weekly throughput to get the expected wait.",
              "cites": [
                "ch02/s02/p002"
              ]
            }
          ]
        },
        {
          "type": "callout",
          "tone": "antipattern",
          "spans": [
            {
              "text": "Starting more work to speed up delivery: at fixed throughput it can only make every item later.",
              "cites": [
                "ch02/s01/p005"
              ]
            }
          ]
        },
        {
          "type": "heading",
          "level": 2,
          "text": "The utilization curve"
        },
        {
          "type": "paragraph",
          "spans": [
            {
              "text": "Waiting stays modest up to about 70% utilization and then rises steeply: at 90% an item waits about nine times its service time.",
              "cites": [
                "ch03/s01/p004",
                "ch03/s01/f001"
              ]
            }
          ]
        },
        {
          "type": "chart",
          "kind": "line",
          "title": "Waiting time against utilization",
          "x": {
            "label": "Utilization (%)",
            "values": [
              50,
              70,
              80,
              90,
              95
            ]
          },
          "y": {
            "label": "Wait (× service time)"
          },
          "series": [
            {
              "name": "Wait",
              "values": [
                1,
                2.3,
                4,
                9,
                19
              ]
            }
          ],
          "cites": [
            "ch03/s01/f001"
          ]
        },
        {
          "type": "callout",
          "tone": "insight",
          "spans": [
            {
              "text": "Variability multiplies the effect of utilization, which is why the same load feels fine one week and jammed the next.",
              "cites": [
                "ch03/s02/p003",
                "ch03/s02/p006"
              ]
            }
          ]
        },
        {
          "type": "callout",
          "tone": "remember",
          "spans": [
            {
              "text": "Keep 15–20% of capacity unallocated.",
              "cites": [
                "ch03/s03/p006"
              ]
            }
          ]
        },
        {
          "type": "heading",
          "level": 2,